{
  "$schema": "./schemas/hash-vectors.schema.json",
  "contract": 3,
  "algorithm": "sha256",
  "encoding": "lowercase hex of the sha256 of the canonical UTF-8 bytes",
  "steps": [
    "Decode the bytes as UTF-8. Refuse anything that is not valid UTF-8; it has no hash.",
    "Strip one leading U+FEFF, if and only if it is the very first code point.",
    "Replace every CRLF with LF, then every remaining lone CR with LF.",
    "Remove code points U+0009, U+000A, U+000B, U+000C, U+000D and U+0020 from both ends, and nothing else. Do not use the language runtime’s own trim.",
    "Append exactly one LF.",
    "Encode as UTF-8. The hash is the lowercase hex sha256 of those bytes, and those bytes are what is stored on disk."
  ],
  "trimCodePoints": [
    "U+0009",
    "U+000A",
    "U+000B",
    "U+000C",
    "U+000D",
    "U+0020"
  ],
  "notes": [
    "inputBase64 is base64 of the raw input bytes; canonicalBase64 is base64 of the bytes after the steps above. Both are base64 because a JSON string cannot carry a lone CR or an invalid byte.",
    "accepted is whether the agent stores the document at all. A vector with accepted false still has a hash when its bytes are valid UTF-8, because canonicalisation happens before the document is inspected; the store then refuses it and the hash is never published.",
    "reject is the first of these that applies, in this order: too-large (more than 1048576 bytes as given), invalid-utf8, empty (the canonical bytes are a single LF), not-a-json-object (the canonical text does not parse as a JSON object with a numeric version and an array machines). It is null exactly when accepted is true.",
    "A client that implements this rule correctly reproduces canonicalBase64 and sha256 for every vector, and refuses every vector whose sha256 is null."
  ],
  "vectors": [
    {
      "name": "plain-no-trailing-newline",
      "purpose": "The baseline. Every other vector that ends in the same document must produce this same hash.",
      "inputBase64": "ewogICJ2ZXJzaW9uIjogMSwKICAibWFjaGluZXMiOiBbCiAgICB7CiAgICAgICJpZCI6ICJiZWFjb24iLAogICAgICAibmFtZSI6ICJCZWFjb24iLAogICAgICAiZW5kcG9pbnRzIjogW3sgImhvc3QiOiAiMTAwLjY0LjEwLjIwIiwgInVzZXIiOiAibWUiLCAicG9ydCI6IDIyIH1dCiAgICB9CiAgXQp9",
      "inputBytes": 171,
      "canonicalBase64": "ewogICJ2ZXJzaW9uIjogMSwKICAibWFjaGluZXMiOiBbCiAgICB7CiAgICAgICJpZCI6ICJiZWFjb24iLAogICAgICAibmFtZSI6ICJCZWFjb24iLAogICAgICAiZW5kcG9pbnRzIjogW3sgImhvc3QiOiAiMTAwLjY0LjEwLjIwIiwgInVzZXIiOiAibWUiLCAicG9ydCI6IDIyIH1dCiAgICB9CiAgXQp9Cg==",
      "canonicalBytes": 172,
      "sha256": "b74478d86f925d9725771221843b39d096046df5e18148e87ed3ac8f7b5913e5",
      "accepted": true,
      "reject": null
    },
    {
      "name": "plain-one-trailing-newline",
      "purpose": "A file the editor ended properly. Same document, so the same hash as plain-no-trailing-newline.",
      "inputBase64": "ewogICJ2ZXJzaW9uIjogMSwKICAibWFjaGluZXMiOiBbCiAgICB7CiAgICAgICJpZCI6ICJiZWFjb24iLAogICAgICAibmFtZSI6ICJCZWFjb24iLAogICAgICAiZW5kcG9pbnRzIjogW3sgImhvc3QiOiAiMTAwLjY0LjEwLjIwIiwgInVzZXIiOiAibWUiLCAicG9ydCI6IDIyIH1dCiAgICB9CiAgXQp9Cg==",
      "inputBytes": 172,
      "canonicalBase64": "ewogICJ2ZXJzaW9uIjogMSwKICAibWFjaGluZXMiOiBbCiAgICB7CiAgICAgICJpZCI6ICJiZWFjb24iLAogICAgICAibmFtZSI6ICJCZWFjb24iLAogICAgICAiZW5kcG9pbnRzIjogW3sgImhvc3QiOiAiMTAwLjY0LjEwLjIwIiwgInVzZXIiOiAibWUiLCAicG9ydCI6IDIyIH1dCiAgICB9CiAgXQp9Cg==",
      "canonicalBytes": 172,
      "sha256": "b74478d86f925d9725771221843b39d096046df5e18148e87ed3ac8f7b5913e5",
      "accepted": true,
      "reject": null
    },
    {
      "name": "many-trailing-newlines",
      "purpose": "Three blank lines at the end collapse to exactly one newline, not to three and not to none.",
      "inputBase64": "ewogICJ2ZXJzaW9uIjogMSwKICAibWFjaGluZXMiOiBbCiAgICB7CiAgICAgICJpZCI6ICJiZWFjb24iLAogICAgICAibmFtZSI6ICJCZWFjb24iLAogICAgICAiZW5kcG9pbnRzIjogW3sgImhvc3QiOiAiMTAwLjY0LjEwLjIwIiwgInVzZXIiOiAibWUiLCAicG9ydCI6IDIyIH1dCiAgICB9CiAgXQp9CgoKCg==",
      "inputBytes": 175,
      "canonicalBase64": "ewogICJ2ZXJzaW9uIjogMSwKICAibWFjaGluZXMiOiBbCiAgICB7CiAgICAgICJpZCI6ICJiZWFjb24iLAogICAgICAibmFtZSI6ICJCZWFjb24iLAogICAgICAiZW5kcG9pbnRzIjogW3sgImhvc3QiOiAiMTAwLjY0LjEwLjIwIiwgInVzZXIiOiAibWUiLCAicG9ydCI6IDIyIH1dCiAgICB9CiAgXQp9Cg==",
      "canonicalBytes": 172,
      "sha256": "b74478d86f925d9725771221843b39d096046df5e18148e87ed3ac8f7b5913e5",
      "accepted": true,
      "reject": null
    },
    {
      "name": "crlf",
      "purpose": "The same document after a Windows editor. Every CRLF becomes one LF; the hash does not change.",
      "inputBase64": "ew0KICAidmVyc2lvbiI6IDEsDQogICJtYWNoaW5lcyI6IFsNCiAgICB7DQogICAgICAiaWQiOiAiYmVhY29uIiwNCiAgICAgICJuYW1lIjogIkJlYWNvbiIsDQogICAgICAiZW5kcG9pbnRzIjogW3sgImhvc3QiOiAiMTAwLjY0LjEwLjIwIiwgInVzZXIiOiAibWUiLCAicG9ydCI6IDIyIH1dDQogICAgfQ0KICBdDQp9",
      "inputBytes": 180,
      "canonicalBase64": "ewogICJ2ZXJzaW9uIjogMSwKICAibWFjaGluZXMiOiBbCiAgICB7CiAgICAgICJpZCI6ICJiZWFjb24iLAogICAgICAibmFtZSI6ICJCZWFjb24iLAogICAgICAiZW5kcG9pbnRzIjogW3sgImhvc3QiOiAiMTAwLjY0LjEwLjIwIiwgInVzZXIiOiAibWUiLCAicG9ydCI6IDIyIH1dCiAgICB9CiAgXQp9Cg==",
      "canonicalBytes": 172,
      "sha256": "b74478d86f925d9725771221843b39d096046df5e18148e87ed3ac8f7b5913e5",
      "accepted": true,
      "reject": null
    },
    {
      "name": "crlf-and-trailing-crlf",
      "purpose": "CRLF throughout and a CRLF at the end. Catches an implementation that converts endings after trimming.",
      "inputBase64": "ew0KICAidmVyc2lvbiI6IDEsDQogICJtYWNoaW5lcyI6IFsNCiAgICB7DQogICAgICAiaWQiOiAiYmVhY29uIiwNCiAgICAgICJuYW1lIjogIkJlYWNvbiIsDQogICAgICAiZW5kcG9pbnRzIjogW3sgImhvc3QiOiAiMTAwLjY0LjEwLjIwIiwgInVzZXIiOiAibWUiLCAicG9ydCI6IDIyIH1dDQogICAgfQ0KICBdDQp9DQo=",
      "inputBytes": 182,
      "canonicalBase64": "ewogICJ2ZXJzaW9uIjogMSwKICAibWFjaGluZXMiOiBbCiAgICB7CiAgICAgICJpZCI6ICJiZWFjb24iLAogICAgICAibmFtZSI6ICJCZWFjb24iLAogICAgICAiZW5kcG9pbnRzIjogW3sgImhvc3QiOiAiMTAwLjY0LjEwLjIwIiwgInVzZXIiOiAibWUiLCAicG9ydCI6IDIyIH1dCiAgICB9CiAgXQp9Cg==",
      "canonicalBytes": 172,
      "sha256": "b74478d86f925d9725771221843b39d096046df5e18148e87ed3ac8f7b5913e5",
      "accepted": true,
      "reject": null
    },
    {
      "name": "cr-only",
      "purpose": "Lone carriage returns, as a classic Mac editor or a mangled transfer leaves them. Each becomes one LF.",
      "inputBase64": "ew0gICJ2ZXJzaW9uIjogMSwNICAibWFjaGluZXMiOiBbDSAgICB7DSAgICAgICJpZCI6ICJiZWFjb24iLA0gICAgICAibmFtZSI6ICJCZWFjb24iLA0gICAgICAiZW5kcG9pbnRzIjogW3sgImhvc3QiOiAiMTAwLjY0LjEwLjIwIiwgInVzZXIiOiAibWUiLCAicG9ydCI6IDIyIH1dDSAgICB9DSAgXQ19",
      "inputBytes": 171,
      "canonicalBase64": "ewogICJ2ZXJzaW9uIjogMSwKICAibWFjaGluZXMiOiBbCiAgICB7CiAgICAgICJpZCI6ICJiZWFjb24iLAogICAgICAibmFtZSI6ICJCZWFjb24iLAogICAgICAiZW5kcG9pbnRzIjogW3sgImhvc3QiOiAiMTAwLjY0LjEwLjIwIiwgInVzZXIiOiAibWUiLCAicG9ydCI6IDIyIH1dCiAgICB9CiAgXQp9Cg==",
      "canonicalBytes": 172,
      "sha256": "b74478d86f925d9725771221843b39d096046df5e18148e87ed3ac8f7b5913e5",
      "accepted": true,
      "reject": null
    },
    {
      "name": "bom",
      "purpose": "A byte order mark from a Windows text editor. Stripped, so the hash matches the plain document.",
      "inputBase64": "77u/ewogICJ2ZXJzaW9uIjogMSwKICAibWFjaGluZXMiOiBbCiAgICB7CiAgICAgICJpZCI6ICJiZWFjb24iLAogICAgICAibmFtZSI6ICJCZWFjb24iLAogICAgICAiZW5kcG9pbnRzIjogW3sgImhvc3QiOiAiMTAwLjY0LjEwLjIwIiwgInVzZXIiOiAibWUiLCAicG9ydCI6IDIyIH1dCiAgICB9CiAgXQp9",
      "inputBytes": 174,
      "canonicalBase64": "ewogICJ2ZXJzaW9uIjogMSwKICAibWFjaGluZXMiOiBbCiAgICB7CiAgICAgICJpZCI6ICJiZWFjb24iLAogICAgICAibmFtZSI6ICJCZWFjb24iLAogICAgICAiZW5kcG9pbnRzIjogW3sgImhvc3QiOiAiMTAwLjY0LjEwLjIwIiwgInVzZXIiOiAibWUiLCAicG9ydCI6IDIyIH1dCiAgICB9CiAgXQp9Cg==",
      "canonicalBytes": 172,
      "sha256": "b74478d86f925d9725771221843b39d096046df5e18148e87ed3ac8f7b5913e5",
      "accepted": true,
      "reject": null
    },
    {
      "name": "bom-crlf-trailing-blank-lines",
      "purpose": "The full Windows treatment at once: BOM, CRLF, and blank lines at the end. Still the same hash.",
      "inputBase64": "77u/ew0KICAidmVyc2lvbiI6IDEsDQogICJtYWNoaW5lcyI6IFsNCiAgICB7DQogICAgICAiaWQiOiAiYmVhY29uIiwNCiAgICAgICJuYW1lIjogIkJlYWNvbiIsDQogICAgICAiZW5kcG9pbnRzIjogW3sgImhvc3QiOiAiMTAwLjY0LjEwLjIwIiwgInVzZXIiOiAibWUiLCAicG9ydCI6IDIyIH1dDQogICAgfQ0KICBdDQp9DQoNCg==",
      "inputBytes": 187,
      "canonicalBase64": "ewogICJ2ZXJzaW9uIjogMSwKICAibWFjaGluZXMiOiBbCiAgICB7CiAgICAgICJpZCI6ICJiZWFjb24iLAogICAgICAibmFtZSI6ICJCZWFjb24iLAogICAgICAiZW5kcG9pbnRzIjogW3sgImhvc3QiOiAiMTAwLjY0LjEwLjIwIiwgInVzZXIiOiAibWUiLCAicG9ydCI6IDIyIH1dCiAgICB9CiAgXQp9Cg==",
      "canonicalBytes": 172,
      "sha256": "b74478d86f925d9725771221843b39d096046df5e18148e87ed3ac8f7b5913e5",
      "accepted": true,
      "reject": null
    },
    {
      "name": "leading-blank-lines-and-spaces",
      "purpose": "A document pasted into a text field that added a blank line and some indentation in front of it.",
      "inputBase64": "CgogICAJewogICJ2ZXJzaW9uIjogMSwKICAibWFjaGluZXMiOiBbCiAgICB7CiAgICAgICJpZCI6ICJiZWFjb24iLAogICAgICAibmFtZSI6ICJCZWFjb24iLAogICAgICAiZW5kcG9pbnRzIjogW3sgImhvc3QiOiAiMTAwLjY0LjEwLjIwIiwgInVzZXIiOiAibWUiLCAicG9ydCI6IDIyIH1dCiAgICB9CiAgXQp9",
      "inputBytes": 177,
      "canonicalBase64": "ewogICJ2ZXJzaW9uIjogMSwKICAibWFjaGluZXMiOiBbCiAgICB7CiAgICAgICJpZCI6ICJiZWFjb24iLAogICAgICAibmFtZSI6ICJCZWFjb24iLAogICAgICAiZW5kcG9pbnRzIjogW3sgImhvc3QiOiAiMTAwLjY0LjEwLjIwIiwgInVzZXIiOiAibWUiLCAicG9ydCI6IDIyIH1dCiAgICB9CiAgXQp9Cg==",
      "canonicalBytes": 172,
      "sha256": "b74478d86f925d9725771221843b39d096046df5e18148e87ed3ac8f7b5913e5",
      "accepted": true,
      "reject": null
    },
    {
      "name": "surrounded-by-whitespace",
      "purpose": "Whitespace of every kind in the trim set on both ends: tab, vertical tab, form feed, space, newline.",